{
  "$schema": "https://json-schema.org/draft/2020-12/schema",
  "$id": "effect_recipes.v1",
  "title": "Effect recipes v1 - one file per recipe under content/video_engine/effects/recipes/<slug>.json (P56 T1)",
  "description": "A recipe is the unit of authoring (E96, 2026-09-13): an ORDERED combination of catalogue effects with offsets, the sentence act it serves, and a played instant in an approved cut that proves it. A member names a card id from docs/EFFECTS-CATALOG.jsonl (or another recipe, acyclic) and may name one of that card's listed options; a member's title and `does` are pulled from its card at build (build_effects_catalog.py), never copied here. `proven` means the ordered members fire inside `window_s` at `proof.t` in `proof.timeline` on disk - the drift gate (effects_catalog_check.py) re-walks the timeline to check it; `candidate` means no cut has carried it yet and it carries no proof. `denied` (P72 T3, E99 s84) means the operator ruled it off: it names `ruled_by` and carries the operator's words verbatim as `denied_reason`, it is never counted proven, and it keeps its proof and count as the record of what was ruled. One file per recipe: a recipe is the merge-collision unit.",
  "$ref": "#/$defs/recipe",
  "$defs": {
    "act": {
      "enum": [
        "QUOTES",
        "RANKS",
        "COMPARES",
        "DIVIDES",
        "NAMES",
        "EXPLAINS",
        "TURNS",
        "BREAKS",
        "SPANS",
        "SETS",
        "RETRACTS"
      ]
    },
    "card_or_recipe_id": {
      "type": "string",
      "pattern": "^([a-z_]+:[A-Za-z0-9_:+.-]+|recipe:[a-z0-9-]+)$",
      "description": "a card id <axis>:<token> from docs/EFFECTS-CATALOG.jsonl, or another recipe's id (nesting; no cycles - the gate checks)"
    },
    "token": {
      "type": "string",
      "minLength": 1,
      "maxLength": 64,
      "pattern": "^[A-Za-z0-9_:+.-]+$"
    },
    "offset": {
      "oneOf": [
        {
          "type": "number",
          "minimum": 0
        },
        {
          "type": "array",
          "minItems": 2,
          "maxItems": 2,
          "items": {
            "type": "number",
            "minimum": 0
          },
          "description": "[lo, hi] when the seed fired at a range of offsets"
        }
      ],
      "description": "seconds from the recipe's first member (the first member is 0.0)"
    },
    "member": {
      "type": "object",
      "additionalProperties": false,
      "required": [
        "card",
        "offset_s",
        "role"
      ],
      "properties": {
        "card": {
          "$ref": "#/$defs/card_or_recipe_id"
        },
        "option": {
          "$ref": "#/$defs/token",
          "description": "a token listed in that card's `options` (how a member names exit:wipe + wipe_right); the gate refuses one the card does not list"
        },
        "offset_s": {
          "$ref": "#/$defs/offset"
        },
        "role": {
          "type": "string",
          "minLength": 5,
          "maxLength": 200,
          "description": "one line: what this member does IN the combination (the claim's qualification stamps)"
        },
        "options": {
          "type": "object",
          "additionalProperties": {
            "type": [
              "number",
              "string",
              "boolean"
            ]
          },
          "description": "authoring defaults the preset hands the author (e.g. {\"dur\": 0.9}); never episode facts"
        },
        "optional": {
          "type": "boolean",
          "description": "true when the seed fired with and without it; the matcher does not require it"
        }
      }
    },
    "proof": {
      "type": "object",
      "additionalProperties": false,
      "required": [
        "project",
        "build",
        "timeline",
        "t",
        "members_at"
      ],
      "properties": {
        "project": {
          "type": "string",
          "minLength": 1,
          "description": "the project slug, e.g. steel-and-paper"
        },
        "build": {
          "type": "string",
          "minLength": 1,
          "description": "the build dir name, e.g. build-f"
        },
        "timeline": {
          "type": "string",
          "pattern": "^content/video_engine/projects/.+\\.timeline\\.json$",
          "description": "repo-relative path of the compiled scene timeline the gate re-walks (must exist on disk)"
        },
        "t": {
          "type": "number",
          "minimum": 0,
          "description": "the first-fire instant: the first member's time in the timeline's clock"
        },
        "members_at": {
          "type": "array",
          "minItems": 2,
          "items": {
            "type": [
              "number",
              "null"
            ],
            "minimum": 0
          },
          "description": "one instant per member, in member order (the audit sheet's frames; the matcher's check); null where an OPTIONAL member is absent at the proof - the gate compares None-ness"
        },
        "scene": {
          "type": [
            "string",
            "null"
          ],
          "description": "the scene_id the first member fires in"
        }
      }
    },
    "recipe": {
      "type": "object",
      "additionalProperties": false,
      "required": [
        "schema_version",
        "id",
        "title",
        "aliases",
        "acts",
        "members",
        "does",
        "status",
        "source",
        "count"
      ],
      "properties": {
        "schema_version": {
          "const": "effect_recipes.v1"
        },
        "id": {
          "type": "string",
          "pattern": "^recipe:[a-z0-9-]+$",
          "description": "recipe:<slug>; the slug is the file name"
        },
        "title": {
          "type": "string",
          "minLength": 3,
          "maxLength": 80,
          "description": "the canonical human name - the doc's or the operator's word where one exists; never a card's title or alias (drift gate)"
        },
        "aliases": {
          "type": "array",
          "items": {
            "type": "object",
            "additionalProperties": false,
            "required": [
              "name",
              "source"
            ],
            "properties": {
              "name": {
                "type": "string",
                "minLength": 2,
                "maxLength": 80
              },
              "source": {
                "type": "string",
                "minLength": 3,
                "description": "path:line or 'operator YYYY-MM-DD (<where recorded>)'"
              }
            }
          },
          "description": "unique across cards AND recipes; never a name in build_effects_catalog.AMBIGUOUS_NAMES (drift gate)"
        },
        "acts": {
          "type": "array",
          "minItems": 1,
          "uniqueItems": true,
          "items": {
            "$ref": "#/$defs/act"
          },
          "description": "the SPECIES-BY-SENTENCE acts the combination serves (the same 11 as effect_card.schema.json `serves`)"
        },
        "members": {
          "type": "array",
          "minItems": 2,
          "items": {
            "$ref": "#/$defs/member"
          },
          "description": "ORDERED; the first member's offset_s is 0.0"
        },
        "window_s": {
          "type": "number",
          "exclusiveMinimum": 0,
          "default": 6.0,
          "description": "the span the members must fall inside for a fire to count (cooc.py's WIN = 6.0); a recipe whose members are docks held across cuts may widen it and say why in `does`"
        },
        "dials": {
          "type": "object",
          "additionalProperties": {
            "type": [
              "number",
              "boolean",
              "string"
            ]
          },
          "description": "the measured laws, as measured (badge ladder: FIRST_BADGE_S 2.05, BADGE_GAP_S 1.30; EMPHASIZE_EQUALS_DATUM true)"
        },
        "dials_source": {
          "type": "string",
          "minLength": 5,
          "description": "where each dial was measured ('41 of 43 Steel docks, 40 gaps all exactly 1.30'); required whenever dials is present"
        },
        "does": {
          "type": "string",
          "minLength": 10,
          "maxLength": 240,
          "description": "one sentence: what the viewer sees the COMBINATION do"
        },
        "doctrine": {
          "type": "array",
          "items": {
            "type": "string",
            "minLength": 2
          },
          "description": "cites resolved through DOCS-INDEX at build (E96, 29 s9.24, CAPABILITIES <row>, BACKLOG R26-103)"
        },
        "status": {
          "enum": [
            "proven",
            "candidate",
            "denied"
          ],
          "description": "proven (an approved cut played it, the proof re-walks), candidate (no cut has, no proof), or denied (P72 T3, E99 s84: the operator ruled it off - it is never counted proven, never offered to the floor, and keeps its proof and count as the record of what was ruled)"
        },
        "ruled_by": {
          "type": "string",
          "pattern": "^E[0-9]+( s[0-9]+)?$",
          "description": "the operator ruling that decided this recipe ('E99 s84'), in docs/portable/OPERATOR-RULINGS.md; required on a denied recipe, allowed on an approved one"
        },
        "denied_reason": {
          "type": "string",
          "minLength": 10,
          "description": "the operator's words on the denial, VERBATIM from the ruling `ruled_by` names - never a paraphrase; only on a denied recipe"
        },
        "use_notes": {
          "type": "array",
          "minItems": 1,
          "items": {
            "type": "object",
            "additionalProperties": false,
            "required": [
              "note",
              "source"
            ],
            "properties": {
              "note": {
                "type": "string",
                "minLength": 2,
                "description": "the words verbatim (the operator's, or the backlog row's)"
              },
              "source": {
                "type": "string",
                "minLength": 3,
                "description": "the ruling or the backlog row the note is quoted from ('E99 s84: approved', 'BACKLOG R26-196 ...')"
              }
            }
          },
          "description": "P72 T3: what the author reads beside an approved recipe - the operator's note on the approval (E99 s84's even pills) and a known edge (R26-196's retitle)"
        },
        "proof": {
          "$ref": "#/$defs/proof"
        },
        "source": {
          "type": "string",
          "minLength": 3,
          "description": "the seed in the spike ('recipes_r1 R1') and T2's re-derived row ('docs/research/runs/p56-recipe-seeds/seeds.jsonl seed R1'), or 'recipes_r1 s4' for a candidate"
        },
        "count": {
          "type": "integer",
          "minimum": 0,
          "description": "how many times the ordered set fired in an approved cut (a recipe that fires once is a decoration; 4x is a grammar); 0 on a candidate"
        },
        "backlog": {
          "type": "array",
          "items": {
            "type": "string",
            "pattern": "^R[0-9]{2}-[0-9]+$"
          }
        },
        "use_when": {
          "type": "object",
          "additionalProperties": false,
          "required": [
            "act",
            "moment",
            "shape",
            "use",
            "dont"
          ],
          "properties": {
            "act": {
              "type": "string",
              "minLength": 3,
              "description": "the sentence's act (SPECIES-BY-SENTENCE)"
            },
            "moment": {
              "type": "string",
              "pattern": "^(hook|setup|proof|turn|reveal|close)( / (hook|setup|proof|turn|reveal|close))*$",
              "description": "hook / setup / proof / turn / reveal / close - one of the six, or several joined by ' / ' (BRAVOS-USE-WHEN.md's own rows carry 'hook / turn'; the stamp recipe carries 'proof / reveal'); any other word is refused"
            },
            "shape": {
              "type": "string",
              "minLength": 3,
              "description": "the data shape the recipe needs"
            },
            "use": {
              "type": "string",
              "minLength": 10,
              "description": "when to reach for it, one line"
            },
            "dont": {
              "type": "string",
              "minLength": 10,
              "description": "when NOT to, one line"
            }
          },
          "description": "P69 T35b / BRAVOS-USE-WHEN.md's fields: an author finds the move by what the sentence is doing"
        }
      },
      "dependentRequired": {
        "dials": [
          "dials_source"
        ]
      },
      "allOf": [
        {
          "if": {
            "properties": {
              "status": {
                "const": "proven"
              }
            }
          },
          "then": {
            "required": [
              "proof"
            ],
            "properties": {
              "count": {
                "minimum": 1
              }
            }
          },
          "else": {
            "if": {
              "properties": {
                "status": {
                  "const": "denied"
                }
              }
            },
            "then": {
              "required": [
                "ruled_by",
                "denied_reason"
              ]
            },
            "else": {
              "not": {
                "required": [
                  "proof"
                ]
              },
              "properties": {
                "count": {
                  "const": 0
                }
              }
            }
          }
        },
        {
          "if": {
            "properties": {
              "status": {
                "const": "denied"
              }
            }
          },
          "else": {
            "not": {
              "required": [
                "denied_reason"
              ]
            }
          }
        }
      ]
    }
  }
}
