{
  "schema_version": "effect_recipes.v1",
  "id": "recipe:dropped-page-then-the-punch",
  "title": "The page drops and the punch lands",
  "aliases": [],
  "acts": [
    "TURNS"
  ],
  "members": [
    {
      "card": "page_enter:drop",
      "offset_s": 0.0,
      "role": "the page falls in and lands as the world"
    },
    {
      "card": "species:punch",
      "offset_s": 0.4,
      "role": "the camera punches to the datum almost on the page's own frame"
    },
    {
      "card": "species:callout",
      "offset_s": 3.6,
      "role": "the scribble names the number once the viewer has already looked at it"
    }
  ],
  "window_s": 6.0,
  "does": "The page falls in from just above and the camera punches to the number before anything names it - R12's grammar with the drop in place of the spiral.",
  "doctrine": [
    "E96",
    "BACKLOG R26-103"
  ],
  "status": "candidate",
  "source": "recipes_r1 s4 (R12 slot)",
  "count": 0
}
