{
  "schema_version": "effect_recipes.v1",
  "id": "recipe:mechanism-drawn-then-counted",
  "title": "The mechanism drawn, then counted",
  "aliases": [],
  "acts": [
    "EXPLAINS",
    "NAMES"
  ],
  "members": [
    {
      "card": "species:flow",
      "offset_s": 0.0,
      "role": "A->B via C, then one node swaps (Bravos' rhyme) - the arrows are kinetics:clothoid"
    },
    {
      "card": "species:callout",
      "offset_s": 2.6,
      "role": "the scribble names the node that swapped"
    },
    {
      "card": "species:count_array",
      "offset_s": 4.6,
      "role": "six crossings counted on an isometric lattice, not traced"
    }
  ],
  "window_s": 10.0,
  "does": "The cause is drawn as named things and the arrows between them, one node is swapped while the rest stands, and the count that makes the point is laid out as icons rather than said.",
  "doctrine": [
    "E96",
    "BACKLOG R26-103"
  ],
  "status": "candidate",
  "source": "recipes_r1 s4 (R7 slot)",
  "count": 0
}
