{
  "schema_version": "effect_recipes.v1",
  "id": "recipe:ranked-bars-race-then-burst",
  "title": "The race and the bar that cannot fit",
  "aliases": [],
  "acts": [
    "RANKS",
    "BREAKS"
  ],
  "members": [
    {
      "card": "page_builder:race",
      "offset_s": 0.0,
      "role": "ranked bars race and stamp (Bravos' form)"
    },
    {
      "card": "overflow:burst",
      "offset_s": 3.4,
      "role": "the bar that cannot fit shoots past the comparator"
    },
    {
      "card": "species:spotlight",
      "offset_s": 5.6,
      "role": "the light lands on the bar that broke the scale"
    }
  ],
  "window_s": 8.0,
  "does": "The ranking is watched, not read: bars race across the periods and stamp their order, then the bar that cannot fit builds to the comparator and shoots past it while the scale rewrites.",
  "doctrine": [
    "E96",
    "BACKLOG R26-103"
  ],
  "status": "candidate",
  "source": "recipes_r1 s4 (R14 slot)",
  "count": 0
}
