{
  "schema_version": "effect_recipes.v1",
  "id": "recipe:trace-callout-ladder",
  "title": "The trace-callout ladder",
  "aliases": [
    {
      "name": "The trace-callout ladder on a narrative plate",
      "source": "docs/research/runs/grill_pipeline-value/recipes_r1.md:149"
    }
  ],
  "acts": [
    "NAMES"
  ],
  "members": [
    {
      "card": "species:trace",
      "offset_s": 0.0,
      "options": {
        "bow": 0.16,
        "draw_s": 0.55,
        "width": 9
      },
      "role": "the route hops from the first named place to the second, drawn in one stroke"
    },
    {
      "card": "species:callout",
      "offset_s": 0.55,
      "options": {
        "label_scale": 2.2
      },
      "role": "the scribble names what was struck there, 0.55 s behind the hop"
    },
    {
      "card": "species:trace",
      "offset_s": 1.26,
      "options": {
        "bow": 0.16,
        "draw_s": 0.55,
        "width": 9
      },
      "role": "the next hop leaves 1.26 s after the last one, back across the picture"
    },
    {
      "card": "species:callout",
      "offset_s": 1.81,
      "options": {
        "label_scale": 2.2
      },
      "role": "the same number is written again at the second place"
    },
    {
      "card": "species:trace",
      "offset_s": 2.52,
      "options": {
        "bow": 0.16,
        "draw_s": 0.55,
        "width": 9
      },
      "role": "the third hop keeps the ladder climbing on the 1.26 s beat"
    },
    {
      "card": "species:callout",
      "offset_s": 3.07,
      "options": {
        "label_scale": 2.2
      },
      "role": "the third label lands and the picture now carries the number at every crossing"
    }
  ],
  "window_s": 6.0,
  "does": "One number is struck at place after place on a bare picture: a hop draws, its label writes 0.55 s later, and the pair repeats every 1.26 s until the whole route is named.",
  "doctrine": [
    "E96",
    "BACKLOG R26-103"
  ],
  "status": "proven",
  "proof": {
    "project": "japan-tariff-trick",
    "build": "build-short",
    "timeline": "content/video_engine/projects/systems-and-blowups/japan-tariff-trick/build-short/japan-short.timeline.json",
    "t": 9.22,
    "members_at": [
      9.22,
      9.77,
      10.48,
      11.03,
      11.74,
      12.29
    ],
    "scene": "s03"
  },
  "source": "recipes_r1 R7; docs/research/runs/p56-recipe-seeds/seeds.jsonl seed R7",
  "count": 4
}
