{
  "schema_version": "effect_recipes.v1",
  "id": "recipe:chart-recast-into-the-other-form",
  "title": "The same data in the other form",
  "aliases": [],
  "acts": [
    "COMPARES",
    "TURNS"
  ],
  "members": [
    {
      "card": "plate_option:then",
      "offset_s": 0.0,
      "role": "declares the second chart state a `chart_to` verb reaches"
    },
    {
      "card": "page_builder:bars",
      "offset_s": 0.0,
      "role": "the page states the comparison and carries its `emphasize` index on the answer bar"
    },
    {
      "card": "page_species:chart_to",
      "offset_s": 2.4,
      "role": "the page-species carrier for all five verbs above"
    },
    {
      "card": "chart_to:recast",
      "offset_s": 2.4,
      "role": "the same data in the other form; the `emphasize` bar keyed out of the line by kinetics:chartxf"
    },
    {
      "card": "species:spotlight",
      "offset_s": 5.4,
      "role": "the light lands on the bar the page had already marked, now that the form has changed"
    }
  ],
  "window_s": 8.0,
  "does": "The argument keeps the data and changes its form: the lines the page built are keyed out into bars in place, and the bar the sentence is about is the one already marked as the answer.",
  "doctrine": [
    "E96",
    "BACKLOG R26-103"
  ],
  "status": "candidate",
  "source": "recipes_r1 s4 (R14 slot)",
  "count": 0
}
