{
  "schema_version": "effect_recipes.v1",
  "id": "recipe:dock-lands-page-renames",
  "title": "The dock lands, the page renames itself",
  "aliases": [],
  "acts": [
    "RETRACTS",
    "TURNS"
  ],
  "members": [
    {
      "card": "page_enter:mount",
      "offset_s": 0.0,
      "role": "the bars page mounts on the cream with the claim the sentence started from"
    },
    {
      "card": "dock_option:read",
      "option": "read_s",
      "offset_s": 8.16,
      "role": "the card pops at its reading box eight seconds in, then parks beside the chart"
    },
    {
      "card": "page_species:retitle",
      "offset_s": 10.36,
      "role": "the page's own title is rewritten to the thing the parked card proves"
    }
  ],
  "window_s": 11.0,
  "does": "The turn: a card lands on the standing page and the page renames itself to what that card proves - the claim is restated, not cut away, so the window runs to the retitle at 10.4 s.",
  "doctrine": [
    "E96",
    "BACKLOG R26-103",
    "E61",
    "E99 s84"
  ],
  "status": "denied",
  "ruled_by": "E99 s84",
  "denied_reason": "off-doctrine: I think we can use our choreography and awareness to better position the cards/charts",
  "proof": {
    "project": "japan-tariff-trick",
    "build": "build-short",
    "timeline": "content/video_engine/projects/systems-and-blowups/japan-tariff-trick/build-short/japan-short.timeline.json",
    "t": 17.42,
    "members_at": [
      17.42,
      25.58,
      27.78
    ],
    "scene": "s04"
  },
  "source": "recipes_r1 R15; docs/research/runs/p56-recipe-seeds/seeds.jsonl seed R15",
  "count": 1
}
