{
  "schema_version": "effect_recipes.v1",
  "id": "recipe:pill-rides-the-line",
  "title": "The pill that rides the line's tip",
  "aliases": [],
  "acts": [
    "TURNS",
    "SPANS"
  ],
  "members": [
    {
      "card": "plate_option:pill",
      "offset_s": 0.0,
      "role": "a value pill riding the line's tip, popping at `build_to`'s datum"
    },
    {
      "card": "page_species:build_to",
      "offset_s": 0.4,
      "role": "the line builds along the page to the datum the sentence has just named"
    },
    {
      "card": "page_species:figure",
      "offset_s": 3.4,
      "role": "the hand writes the figure at the datum the pill stopped on"
    }
  ],
  "window_s": 6.0,
  "does": "The number is never hunted for: a value pill rides the tip of the line as it builds and pops at the datum the sentence named, and the hand writes the figure there.",
  "doctrine": [
    "E96",
    "BACKLOG R26-103"
  ],
  "status": "candidate",
  "source": "recipes_r1 s4 (R10 slot)",
  "count": 0
}
