{
  "schema_version": "effect_recipes.v1",
  "id": "recipe:plate-dock-wipe",
  "title": "The plate, the dock and the carried wipe",
  "aliases": [
    {
      "name": "Plate, Ken Burns, the dock lands, the wipe carries the light",
      "source": "docs/research/runs/grill_pipeline-value/recipes_r1.md:87"
    }
  ],
  "acts": [
    "EXPLAINS",
    "QUOTES"
  ],
  "members": [
    {
      "card": "plate_option:world",
      "offset_s": 0.0,
      "role": "the bare plate is the world the claim is made on - no ledger page, so the card has a room to land in"
    },
    {
      "card": "plate_option:ken",
      "offset_s": 0.0,
      "role": "the same plate carries its own Ken Burns push and drift, so the room is never still under the card"
    },
    {
      "card": "dock_kind:image",
      "offset_s": 0.0,
      "role": "the evidence dock lands on that plate as a still image card"
    },
    {
      "card": "dock_payload:chart",
      "offset_s": 0.0,
      "role": "the card's payload is a chart surface - the claim's figure, not a photograph"
    },
    {
      "card": "dock_option:badge",
      "offset_s": 2.05,
      "optional": true,
      "role": "the badge rail stamps the claim's qualification 2.05 s after the card lands (all 15 Steel fires carry one; optional because a bare card is legal)"
    },
    {
      "card": "exit:wipe",
      "option": "wipe_right",
      "offset_s": [
        2.4,
        30.0
      ],
      "role": "the hard-edge wipe carries the card's light off the plate and reveals the next room under it"
    }
  ],
  "window_s": 31.0,
  "does": "A chart card lands on a Ken Burns plate, its badge stamps, and the whole room is carried off by a right-hand wipe - the window runs to 31 s because the wipe waits for the plate's whole claim.",
  "doctrine": [
    "E96",
    "BACKLOG R26-103",
    "E61",
    "E99 s84"
  ],
  "status": "denied",
  "ruled_by": "E99 s84",
  "denied_reason": "off-doctrine: You literally docked and wiped then held a still frame for 30 seconds. If it's an evidence dock it should re-choreograph not to be center, if it's meant to become the plate, then it should be snapping/zooming in on the evidence layer. we're not gaining anything by wiping to a narrative plate and docking a barely legible chart over the top, especially when the chart is docked over the center of the narrative plate, not being scene aware.",
  "proof": {
    "project": "steel-and-paper",
    "build": "build-f",
    "timeline": "content/video_engine/projects/systems-and-blowups/steel-and-paper/build-f/steel-and-paper.timeline.json",
    "t": 595.5,
    "members_at": [
      595.5,
      595.5,
      595.6,
      595.6,
      597.65,
      598.0
    ],
    "scene": "s57"
  },
  "source": "recipes_r1 R2; docs/research/runs/p56-recipe-seeds/seeds.jsonl seed R2",
  "count": 15
}
