{
  "schema_version": "effect_recipes.v1",
  "id": "recipe:melt-then-rewrite",
  "title": "The melt, then the re-write",
  "aliases": [],
  "acts": [
    "COMPARES",
    "EXPLAINS"
  ],
  "members": [
    {
      "card": "page_species:figure",
      "offset_s": 0.0,
      "role": "the figure is WRITTEN at its datum by the hand (E50) - the number as it is quoted"
    },
    {
      "card": "page_species:chart_to",
      "offset_s": 6.0,
      "role": "the page-species carrier for the verb"
    },
    {
      "card": "chart_to:compare",
      "option": "streak",
      "offset_s": 6.0,
      "role": "the figure's own ink MELTS where it stands (E88's melt - the ink, never the board) and the hand RE-WRITES the new number at the SAME datum"
    }
  ],
  "window_s": 9.0,
  "does": "A written figure melts off its own datum and the hand re-writes what it means in the same place: the number leaves as ink and comes back as something else, with the board never moving.",
  "doctrine": [
    "E88",
    "E50",
    "E76",
    "E96",
    "BACKLOG R26-116",
    "BACKLOG R26-70"
  ],
  "status": "candidate",
  "source": "the golden compare-streak (tests/golden/build_golden_sources.py compare_streak, frames compare-streak@proof-quoted / @proof-melt / @proof-write): P57 T12b's text melt, kept as `form: streak`; the operator 2026-09-14: \"the method i described may become one of our effect-combination stacks\" - no approved cut carries it (P72 T3 step (0))",
  "count": 0,
  "backlog": [
    "R26-116"
  ]
}
